{
  "$schema": "https://json-schema.org/draft/2020-12/schema",
  "type": "object",
  "required": ["title", "status", "date", "context", "decision", "consequences", "alternatives"],
  "additionalProperties": false,
  "properties": {
    "title": { "type": "string", "minLength": 1 },
    "status": { "type": "string", "enum": ["proposed", "accepted", "deprecated"] },
    "date": { "type": "string", "minLength": 1 },
    "context": { "type": "string", "minLength": 1 },
    "decision": { "type": "string", "minLength": 1 },
    "consequences": { "type": "string", "minLength": 1 },
    "alternatives": {
      "type": "array",
      "minItems": 1,
      "items": {
        "type": "object",
        "required": ["title", "description"],
        "additionalProperties": false,
        "properties": {
          "title": { "type": "string" },
          "description": { "type": "string" }
        }
      }
    },
    "typst_snippets": {
      "type": "object",
      "additionalProperties": false,
      "properties": {
        "footer_note": { "type": "string", "maxLength": 500 }
      }
    }
  }
}
